CodigoUnidad, NombreFacultad, CodigoUnidadCarrera, CodigoCarrera, NombreCarrera, CodigoCarreraEnfasis, CodigoEnfasis, NombreEnfasis, CodigoCarreraCurso, CodigoEnfasisCurso, SiglaCurso, NombreCurso, SiglaCursoGrupo, NumeroGrupo, Semestre, Anno, CorreoPersona, IdPersona, TipoIdPersona, NombrePersona, ApellidoPersona,Borrado,CorreoProfesor,CorreoEstudiante, SiglaCursoImparte, NumeroGrupoImparte, SemestreGrupoImparte, AnnoGrupoImparte, CorreoImparte, SiglaCursoMatricula, NumeroGrupoMatricula, SemestreMatricula, AnnoMatricula, CorreoMatricula
IN00000001, Escuela de Ingeniería Eléctrica, IN00000001, C000000001, Ingeniería Eléctrica, C000000001, E000000001, Ingeniería Eléctrica, , , , , , , , , cristian.quesada@ucr.ac.cr,100000001, Cédula, Cristian, Quesada,False,cristian.quesada@ucr.ac.cr,, , , , , , , , , , 
IN00000002, Escuela de Ingeniería Mecánica, IN00000002, C000000002, Ingeniería Mecánica, C000000002, E000000001, Ingeniería Mecánica, , , , , , , , , ismael.gutierrezhidalgo@ucr.ac.cr,400000001, Cédula, Ismael, Gutiérrez,False,,ismael.gutierrezhidalgo@ucr.ac.cr, , , , , , , , , , 
IN00000003, Escuela de Computación e Informática, IN00000003, C000000003, Bachillerato en Computación, C000000003, E000000001, Ciencias de la Computación, C000000003, E000000002, CI0135, Interacción Humano Computador, CI0135,2,2,2019, alvaro.delaossa@ucr.ac.cr,100000002, Cédula, Alvaro, De La Ossa,False,alvaro.delaossa@ucr.ac.cr,, CI0135,1,2,2019, cristian.quesada@ucr.ac.cr, , , , , 
FA00000001, Facultad de Farmacia, FA00000001, C000000004, Farmacia, C000000003, E000000002, Ingeniería de Software, C000000003, E000000001, CI0129, Inteligencia Artificial, CI0129,1,2,2019, , , , , ,,,, CI0129,1,2,2019, alvaro.delaossa@ucr.ac.cr, CI0129,1,2,2019, ismael.gutierrezhidalgo@ucr.ac.cr
MI00000001, Facultad de Microbiología, MI00000001, C000000005, Microbiología y Química Clínica, C000000003, E000000003, Tecnologías de la Información, C000000003, E000000001, CI0132, Teoría de la Computación, CI0135,1,2,2019, , , , , ,,,, CI0135,2,2,2019, cristian.quesada@ucr.ac.cr, , , , , 
 , , MI00000001, C000000006, Asistente de Laboratorio, C000000004, E000000001, Farmacia, , , , , , , , , , , , , ,,,, , , , , , , , , , 
